{
    "$schema": "https://sci-d-vis.com/schema/wtrl-authoring-object-json-0.4.0.schema.json",
    "$id": "urn:waterlint:wtrl-authoring-object-json:waterloo_authoring_showcase.Child.describe",
    "__WTRL_CATEGORY__": "wtrl-authoring-object-json",
    "__WTRL_VERSION__": {"schema": "0.4.0"},
    "qualified_name": "waterloo_authoring_showcase.Child.describe",
    "profile": "inherited_method",
    "signature": "(self) -> str",
    "doc": {
        "Preamble": {
            "profile": "inherited_method",
            "normative_sections": ["Definitions", "Contract"],
            "scope": ["public"]
        },
        "Definitions": {
            "InheritedBehavior": [{"paragraph": "Behavior supplied by a base-class method."}]
        },
        "Contract": {
            "general": ["|Must| retain the behavior of the referenced base method."],
            "base": "waterloo_authoring_showcase.Base.describe"
        },
        "Description": [
            {"paragraph": "An inherited-method document records its base implementation explicitly."},
            {"table": {"groups": [{
                "columns": [{"key": "source", "header": "Source"}, {"key": "behavior", "header": "Behavior"}],
                "rows": [{"cells": {"source": "Base.describe", "behavior": "Inherited without local changes."}}]
            }]}}
        ],
        "Notes": {
            "Override": [{"paragraph": "Use a method profile rather than inherited_method when the subclass changes the contract."}]
        }
    }
}
